CODIGO,DISTRITO,DEPARTAMENTO,MUNICIPIO,ESTABLECIMIENTO,DIRECCION,TELEFONO,SUPERVISOR,DIRECTOR,NIVEL,SECTOR,AREA,STATUS,MODALIDAD,JORNADA,PLAN,DEPARTAMENTAL
17-04-0085-46,17-004,peten,san andres,liceo santa cruz,barrio norte san andres,51623061,barbara juliaivone lopez vargas,teresa de jesus chi vanegas,diversificado,privado,urbana,cerrada temporalmente,monolingue,vespertina,diario(regular),peten
17-04-0090-46,17-004,peten,san andres,"centro educativo ""the jungle school""",rancho corazones en accion km. 11.5 carretera carmelita,48623733,barbara juliaivone lopez vargas,edil adolfo pineda santos,diversificado,privado,rural,abierta,monolingue,matutina,diario(regular),peten
17-04-0095-46,17-002,peten,san andres,"colegio privado con orientacion cristiana ""liceo emanuel""",casero cruce dos aguadas.,44918380,lilia saudita suntecun chan de vitzil,orpha hondina caballeros castillo,diversificado,privado,rural,cerrada temporalmente,monolingue,vespertina,diario(regular),peten
17-04-0099-46,17-002,peten,san andres,centro educativo de formacion integral- cefi-,caserio cruce dos aguadas,53196330,lilia saudita suntecun chan de vitzil,wilmer acuna alvarado,diversificado,privado,rural,abierta,monolingue,doble,fin de semana,peten
17-04-0103-46,17-004,peten,san andres,"colegio ""lideres del manana""",barrio corozal sacpuy,31807694,barbara juliaivone lopez vargas,gil alberto arroyo figueroa,diversificado,privado,rural,abierta,monolingue,doble,fin de semana,peten
17-04-0104-46,17-004,peten,san andres,instituto de educacion diversificada,barrio noreste,44875480,barbara juliaivone lopez vargas,hector de jesus giron manzanero,diversificado,privado,urbana,abierta,monolingue,vespertina,diario(regular),peten
17-04-0112-46,17-004,peten,san andres,centro educativo lideres del manana,barrio corozal aldea sacpuy,53585684,barbara juliaivone lopez vargas,ana gloria reyna yanes de rosa,diversificado,privado,rural,abierta,monolingue,doble,fin de semana,peten
17-04-0116-46,17-002,peten,san andres,instituto dde educacion diversificada-ied-,caserio cruce dos aguadas,37155270,lilia saudita suntecun chan de vitzil,enna yamileth urrutia juarez,diversificado,privado,rural,abierta,monolingue,vespertina,diario(regular),peten
17-04-0117-46,17-004,peten,san andres,liceo sacpuy-lisac-,aldea sacpuy-lisac-,46452466,barbara juliaivone lopez vargas,walquiria bersabit ramos panti,diversificado,privado,rural,abierta,monolingue,sin jornada,semipresencial (un dia a la semana),peten
17-04-0119-46,17-002,peten,san andres,centro educativo de formacion integral-cefi-,caserio cruce dos aguadas,58180976,lilia saudita suntecun chan de vitzil,wilmer acuna alvarado,diversificado,privado,rural,abierta,monolingue,sin jornada,semipresencial (un dia a la semana),peten
17-04-0483-46,desconocido,peten,san andres,instituto privado mixto de educacion diversificada de ciencias comerciales,desconocido,desconocido,desconocido,desconocido,diversificado,privado,urbana,cerrada temporalmente,monolingue,vespertina,diario(regular),peten
17-04-2974-46,desconocido,peten,san andres,centro de formacion de maestros de educacion primaria urbana,san andres,desconocido,desconocido,teresa de jesus chi vanegas,diversificado,privado,urbana,cerrada temporalmente,monolingue,vespertina,diario(regular),peten
17-04-3953-46,17-004,peten,san andres,liceo sacpuy -lisac,barrio el centro aldea sacpuy,33714796,barbara juliaivone lopez vargas,walkiria bersabit ramos panti,diversificado,privado,rural,abierta,monolingue,matutina,diario(regular),peten
17-04-4071-46,17-004,peten,san andres,colegio lideres del manana,aldea sacpuy,31807694,barbara juliaivone lopez vargas,desconocido,diversificado,privado,rural,cerrada temporalmente,monolingue,vespertina,diario(regular),peten
17-04-4076-46,17-004,peten,san andres,liceo sacpuy lisac,barrio el centro sacpuy,33714796,barbara juliaivone lopez vargas,walkiria bersabit ramos panti,diversificado,privado,rural,abierta,monolingue,doble,fin de semana,peten
17-05-0167-46,17-007,peten,la libertad,instituto nacional de educacion diversificada,aldea el naranjo,desconocido,hugo rene macz pop,desconocido,diversificado,oficial,rural,abierta,monolingue,matutina,diario(regular),peten
17-05-0168-46,17-006,peten,la libertad,instituto nacional de educacion diversificada ined,nueva lotificacion,30327264,gregorio enrique argueta samayoa,edwin amilcar garcia izaguirre,diversificado,oficial,rural,abierta,monolingue,vespertina,diario(regular),peten
17-05-0186-46,17-007,peten,la libertad,"colegio privado mixto ""mayen""",caserio nuevo eden,49858492,hugo rene macz pop,martir fabian mangandid,diversificado,privado,rural,abierta,monolingue,doble,fin de semana,peten
17-05-0188-46,17-007,peten,la libertad,"colegio privado mixto ""jesus el divino maestro"" -jedima-",caserio bethania,desconocido,hugo rene macz pop,luciano ramirez popa,diversificado,privado,rural,cerrada temporalmente,monolingue,vespertina,diario(regular),peten
17-05-0198-46,17-006,peten,la libertad,escuela normal central,barrio el centro la libertad,46721701,gregorio enrique argueta samayoa,carlos alejandro duran ramirez,diversificado,privado,urbana,abierta,monolingue,vespertina,diario(regular),peten
17-05-0199-46,17-006,peten,la libertad,"colegio privado mixto, ""el plantel""",caserio el plantel la libertad,47957230,gregorio enrique argueta samayoa,rodolfo augusto hernandez munguia,diversificado,privado,rural,abierta,monolingue,doble,fin de semana,peten
17-05-0200-46,17-007,peten,la libertad,"centro educativo integral, ""fagioli""","barrio el centro, aldea el naranjo",57816239,hugo rene macz pop,asmavet edgar de leon yoc,diversificado,privado,rural,abierta,monolingue,doble,fin de semana,peten
17-05-0208-46,17-007,peten,la libertad,"colegio de ciencias comerciales las cruces, con orientacion en computacion",aldea las cruces,79273890,hugo rene macz pop,araceli sandoval vasquez,diversificado,privado,rural,cerrada temporalmente,monolingue,matutina,diario(regular),peten
17-05-0209-46,17-007,peten,la libertad,"colegio de ciencias comerciales las cruces, con orientacion en computacion",aldea las cruces,79273890,hugo rene macz pop,araceli sandoval vasquez,diversificado,privado,rural,cerrada temporalmente,monolingue,doble,fin de semana,peten
17-05-0210-46,17-007,peten,la libertad,"colegio de ciencias comerciales las cruces, con orientacion en computacion",aldea las cruces,79277390,hugo rene macz pop,desconocido,diversificado,privado,rural,cerrada temporalmente,monolingue,matutina,diario(regular),peten
17-05-0211-46,17-007,peten,la libertad,centro de educacion integral el naranjo,barrio el centro aldea el naranjo,57283598,hugo rene macz pop,mirian virginia martinez cante,diversificado,privado,rural,abierta,monolingue,vespertina,diario(regular),peten
17-05-0216-46,17-006,peten,la libertad,colegio santa cruz,la libertad,79243704,gregorio enrique argueta samayoa,abilio quinonez corado,diversificado,privado,rural,abierta,monolingue,vespertina,diario(regular),peten
17-05-0217-46,17-007,peten,la libertad,"centro educativo integral, fagioli","barrio el centro, aldea el naranjo",57816239,hugo rene macz pop,asmavet edgar de leon yoc,diversificado,privado,rural,abierta,monolingue,vespertina,diario(regular),peten
17-05-0223-46,17-007,peten,la libertad,colegio mixto bilingue britannia,aldea el naranjo,58922188,hugo rene macz pop,victor hugo carranza castellanos,diversificado,privado,rural,abierta,monolingue,vespertina,diario(regular),peten
17-05-0224-46,17-007,peten,la libertad,colegio privado mixto mayen,caserio nuevo eden,49858492,hugo rene macz pop,marlene cecibel alarcon acosta,diversificado,privado,rural,abierta,monolingue,vespertina,diario(regular),peten
17-05-0225-46,17-008,peten,la libertad,instituto mixto de educacion bilingue intercultural -imebi- lagunitas,caserio lagunitas,30377199,alfonzo claudio sales,evelia floridalma milian milian,diversificado,privado,rural,cerrada temporalmente,bilingue,doble,fin de semana,peten
17-05-0226-46,17-006,peten,la libertad,instituto mixto de educacion bilingue intercultural -imebi- la libertad,barrio el estadio,30989090,gregorio enrique argueta samayoa,martin ramirez silvestre,diversificado,privado,rural,cerrada temporalmente,bilingue,doble,fin de semana,peten
17-05-0227-46,17-008,peten,la libertad,instituto mixto de educacion bilingue intercultural -imebi- guatelinda san diego,caserio guatelinda san diego,40894718,alfonzo claudio sales,nehemias saul garcia florian,diversificado,privado,rural,cerrada temporalmente,bilingue,doble,fin de semana,peten
17-05-0228-46,17-007,peten,la libertad,colegio privado mixto -jedima- palestina,caserio palestina,40311962,hugo rene macz pop,ingrid elizabeth perez ramos,diversificado,privado,rural,cerrada temporalmente,monolingue,vespertina,diario(regular),peten
17-05-0230-46,17-006,peten,la libertad,instituto mixto de educacion bilingue intercultural -imebi- vista hermosa,caserio vista hermosa,desconocido,gregorio enrique argueta samayoa,andres domingo paiz,diversificado,privado,rural,cerrada temporalmente,bilingue,doble,fin de semana,peten
17-05-0232-46,17-006,peten,la libertad,liceo mixto moderno santa fe,barrio el centro la libertad,55742301,gregorio enrique argueta samayoa,delmi gabriela luna sierra de pineda,diversificado,privado,urbana,abierta,monolingue,vespertina,diario(regular),peten
17-05-0234-46,17-006,peten,la libertad,liceo mixto moderno santa fe,barrio el centro,45309965,gregorio enrique argueta samayoa,delmi gabriela luna sierra de pineda,diversificado,privado,urbana,abierta,monolingue,vespertina,diario(regular),peten
17-05-0238-46,17-006,peten,la libertad,"liceo integral ciencia y verdad ""ciev""",barrio el estadio,46967643,gregorio enrique argueta samayoa,ana yojana ortiz moran,diversificado,privado,urbana,abierta,monolingue,vespertina,diario(regular),peten
17-05-0249-46,17-006,peten,la libertad,"colegio mixto privado ""martha maria""","caserio nueva vista hermosa, kilometro 35",45734290,gregorio enrique argueta samayoa,juan antonio lemus lopez,diversificado,privado,rural,abierta,monolingue,vespertina,diario(regular),peten
17-05-0250-46,17-007,peten,la libertad,colegio mixto bilingue britannia,barrio once de noviembre aldea el naranjo,58922188,hugo rene macz pop,haydee dalila iemimah carranza tambito,diversificado,privado,rural,abierta,monolingue,doble,fin de semana,peten
17-05-0257-46,17-008,peten,la libertad,colegio mixto de educacion media -cmem- el innovador,caserio guatelinda san diego,45386655,alfonzo claudio sales,rony gonzalo manzanero gonzalez,diversificado,privado,rural,abierta,monolingue,vespertina,diario(regular),peten
17-05-0258-46,17-007,peten,la libertad,"colegio mixto biligue ""britannia""",aldea el naranjo,51617598,hugo rene macz pop,haydee dalila carranza tambito,diversificado,privado,rural,abierta,monolingue,doble,fin de semana,peten
17-05-0260-46,17-007,peten,la libertad,centro de educacion integral el naranjo,aldea el naranjo,57283598,hugo rene macz pop,paz sosa manuel elias,diversificado,privado,rural,abierta,bilingue,doble,fin de semana,peten
17-05-0261-46,17-006,peten,la libertad,instituto mixto de educacion bilingue intercul,barrio santa cruz,30989090,gregorio enrique argueta samayoa,martin ramirez silvestre,diversificado,privado,rural,abierta,monolingue,vespertina,diario(regular),peten
17-05-0267-46,17-006,peten,la libertad,colegio mixto cristiano jesucristo vive por siempre,barrio buena vista,45031691,gregorio enrique argueta samayoa,waleska estefania bolanos sanchez,diversificado,privado,urbana,cerrada temporalmente,monolingue,vespertina,diario(regular),peten
17-05-0271-46,17-047,peten,la libertad,"colegio mixto pribado ""a rabi basaj""(jesucristo vive por siempre)",caserio el ceibo,45031691,vilma aracely garcia crisostomo,cladia elizabeth poco ochaeta,diversificado,privado,rural,abierta,monolingue,vespertina,diario(regular),peten
17-05-0280-46,17-041,peten,la libertad,"centro educativo ""miguel angel florian""",barrio el centro caserio las ruinas,49480844,martir fabian mangandid,miguel angel floria zuniga,diversificado,privado,rural,abierta,monolingue,vespertina,diario(regular),peten
17-05-0290-46,17-006,peten,la libertad,colegio santa cruz,barrio santa ruz,79243704,gregorio enrique argueta samayoa,martin ramirez silvestre,diversificado,privado,rural,abierta,monolingue,doble,fin de semana,peten
17-05-0294-46,17-007,peten,la libertad,liceo educativo sicar,aldea el naranjo-barrio de juarez,45041903,hugo rene macz pop,marleny maribel miulian milian,diversificado,privado,rural,abierta,monolingue,vespertina,diario(regular),peten
17-05-0296-46,17-007,peten,la libertad,liceo educativo sicar,aldea el naranjo barrio lo de juarez,45041903,hugo rene macz pop,esmilda osiris ramos pancan,diversificado,privado,rural,cerrada temporalmente,monolingue,doble,fin de semana,peten
17-05-0297-46,17-007,peten,la libertad,cwentro educativo sicar,aldea el naranjo barrio lo de juarez,45041903,hugo rene macz pop,esmilda osiris ramos pancan,diversificado,privado,rural,cerrada temporalmente,monolingue,doble,fin de semana,peten
17-05-0298-46,17-008,peten,la libertad,instituto nacional de educacion diversificada- ined-,caserio las ruinas,33254332,alfonzo claudio sales,dario gonzalo coc cucul,diversificado,oficial,rural,abierta,monolingue,vespertina,diario(regular),peten
17-05-0299-46,17-008,peten,la libertad,"colegio de educacion integral con orientacion universitaria, ""el poder del saber""",caserio guatelinda san diego,57564332,alfonzo claudio sales,wilian uvaldo merida muy,diversificado,privado,rural,abierta,monolingue,doble,fin de semana,peten
17-05-0301-46,17-008,peten,la libertad,"colegio mixto de educacion media ""el innovador""",guatelinda san diego,48388684,alfonzo claudio sales,martin choc xol,diversificado,privado,rural,abierta,monolingue,doble,fin de semana,peten
17-05-0305-46,17-006,peten,la libertad,escuela normal con orientacion ambiental,barrio el centro,30748520,gregorio enrique argueta samayoa,graciela de jesus franco castillo,diversificado,privado,urbana,abierta,monolingue,doble,fin de semana,peten
17-05-0306-46,17-006,peten,la libertad,escuela normal con orientacion ambiental,barrio el centro,45734290,gregorio enrique argueta samayoa,graciela de jesus franco castillo,diversificado,privado,urbana,abierta,monolingue,doble,fin de semana,peten
17-05-0308-46,17-007,peten,la libertad,"centro educativo ""san pedro"", fe y alegria, no. 37.",aldea el naranjo,53085257,hugo rene macz pop,evelia floridalma milian y milian,diversificado,privado,rural,abierta,monolingue,matutina,diario(regular),peten
17-05-0309-46,17-007,peten,la libertad,centro educativo san pedro fe y alegria no.41,caserio lagunitas,59514752,hugo rene macz pop,anita imelda maza polo,diversificado,privado,rural,abierta,monolingue,vespertina,diario(regular),peten
17-05-0310-46,17-006,peten,la libertad,instituto indigena para el desarrollo rural integral indri,canton el cruce a aldea la esperanza,51510194,gregorio enrique argueta samayoa,alfredo francisco che choc,diversificado,privado,rural,abierta,bilingue,doble,diario(regular),peten
17-05-0319-46,17-007,peten,la libertad,centro de educacion integral el naranjo,aldea el naranjo,53663885,hugo rene macz pop,mirian virginia martinez cante,diversificado,privado,rural,abierta,monolingue,matutina,diario(regular),peten
17-05-0320-46,17-006,peten,la libertad,centro educativo guadalupano,barrio el centro,30366955,gregorio enrique argueta samayoa,ingri cano guerra de sanchez,diversificado,privado,urbana,abierta,monolingue,doble,fin de semana,peten
17-05-0321-46,17-006,peten,la libertad,centro educativo guadalupano,barrio el centro,30366955,gregorio enrique argueta samayoa,ingri cano guerra de sanchez,diversificado,privado,urbana,abierta,monolingue,doble,fin de semana,peten
17-05-0326-46,17-008,peten,la libertad,colegio de educacion integral con orientacion universitaria el poder del saber,aldea guatelinda san diego,57264881,alfonzo claudio sales,wilian uvaldo merida muy,diversificado,privado,rural,abierta,monolingue,sin jornada,fin de semana,peten
17-05-0330-46,17-006,peten,la libertad,colegio santa cruz,barrio santa cruz,53407688,gregorio enrique argueta samayoa,martin ramirez silvestre,diversificado,privado,urbana,abierta,monolingue,sin jornada,semipresencial (un dia a la semana),peten
17-05-0332-46,17-007,peten,la libertad,instituto nacional de educacion diversificada ined,caserio pozo azul,55841567,hugo rene macz pop,edras donaldo portillo gomez,diversificado,oficial,rural,abierta,monolingue,vespertina,diario(regular),peten
17-05-0333-46,17-007,peten,la libertad,centro educativo integral fagioli,aldea el naranjo,57816239,hugo rene macz pop,asmavet edgar de leon yoc,diversificado,privado,rural,abierta,monolingue,sin jornada,semipresencial (fin de semana),peten
17-05-0335-46,17-006,peten,la libertad,centro de educacion integral el naranjo-cein-,aldea el naranjo,53663885,gregorio enrique argueta samayoa,miriam virgina artinez cant+e,diversificado,privado,rural,abierta,monolingue,sin jornada,semipresencial (un dia a la semana),peten
17-05-0337-46,17-006,peten,la libertad,escuela normal con orientacion ambiental-enca-,barriio el centro,45734290,gregorio enrique argueta samayoa,carlos alejandro duran ramirez,diversificado,privado,urbana,abierta,monolingue,sin jornada,semipresencial (un dia a la semana),peten
17-05-0340-46,17-006,peten,la libertad,centro educativo guadalupano,"barrio el ,centro",30366955,gregorio enrique argueta samayoa,henry rolando sanchez matus,diversificado,privado,urbana,abierta,monolingue,sin jornada,semipresencial (un dia a la semana),peten
17-05-0342-46,17-008,peten,la libertad,colegio mixto de educacion media cmem el innovador,caserio guatelinda san diego,50060406,alfonzo claudio sales,rony gonzalo manzanero gonzalez,diversificado,privado,rural,abierta,monolingue,sin jornada,semipresencial (un dia a la semana),peten
17-05-0343-46,17-007,peten,la libertad,ccenro educativo fe y alegria no.37,aldea el naranjo,59221159,hugo rene macz pop,raquel milian y milian,diversificado,privado,rural,abierta,monolingue,doble,semipresencial,peten
17-05-0490-46,desconocido,peten,la libertad,instituto privado mixto de educacion diversificada de bachillerato en ciencias y letras jn,desconocido,desconocido,desconocido,desconocido,diversificado,privado,urbana,cerrada temporalmente,monolingue,nocturna,diario(regular),peten
17-05-1308-46,desconocido,peten,la libertad,instituto privado mixto nocturno,desconocido,desconocido,desconocido,desconocido,diversificado,privado,rural,cerrada temporalmente,monolingue,nocturna,diario(regular),peten
17-05-2230-46,desconocido,peten,la libertad,instituto privado mixto nocturno de ciencias comerciales,aldea los cruces,desconocido,desconocido,desconocido,diversificado,privado,urbana,cerrada temporalmente,monolingue,nocturna,diario(regular),peten
17-05-3351-46,17-007,peten,la libertad,colegio de ciencias comerciales las cruces con orientacion en computacion,aldea las cruces,79277390,hugo rene macz pop,desconocido,diversificado,privado,rural,cerrada temporalmente,monolingue,vespertina,diario(regular),peten
17-05-3658-46,17-006,peten,la libertad,escuela normal con orientacion ambiental,barrio el centro la libertad,45734290,gregorio enrique argueta samayoa,--,diversificado,privado,urbana,abierta,monolingue,vespertina,diario(regular),peten
17-05-3659-46,17-007,peten,la libertad,colegio privado mixto el divino maestro,aldea las cruces,desconocido,hugo rene macz pop,--,diversificado,privado,rural,cerrada temporalmente,monolingue,vespertina,diario(regular),peten
17-05-3885-46,17-007,peten,la libertad,colegio mixto adventista getsemani,aldea las cruces,desconocido,hugo rene macz pop,desconocido,diversificado,privado,rural,cerrada temporalmente,monolingue,vespertina,diario(regular),peten
17-05-4008-46,17-006,peten,la libertad,instituto tecnologico en recursos naturales saklum,canton el cruce aldea la esperanza,53239274,gregorio enrique argueta samayoa,carlos manuel acosta aldana,diversificado,privado,rural,abierta,monolingue,doble,diario(regular),peten
17-05-4057-46,17-006,peten,la libertad,colegio santa cruz,barrio santa cruz,79243704,gregorio enrique argueta samayoa,desconocido,diversificado,privado,rural,abierta,monolingue,doble,fin de semana,peten
17-05-4067-46,17-006,peten,la libertad,escuela normal con orientacion ambiental,barrio el centro,45734290,gregorio enrique argueta samayoa,fredy matias,diversificado,privado,urbana,cerrada temporalmente,monolingue,doble,fin de semana,peten
17-05-4181-46,17-007,peten,la libertad,colegio privado mixto 'el divino maestro',aldea las cruces,desconocido,hugo rene macz pop,desconocido,diversificado,privado,rural,cerrada temporalmente,monolingue,doble,fin de semana,peten
17-06-0023-46,17-009,peten,san francisco,instituto nacional de educacion diversificada,barrio san rafael,30759288,alvis orlando corado carrillo,sulmi yomaris salas perez de hernandez,diversificado,oficial,urbana,abierta,monolingue,vespertina,diario(regular),peten
17-06-0028-46,17-009,peten,san francisco,centro educativo mayab,10calle3ra.ave. zona 1,54826739,alvis orlando corado carrillo,evelin vanessa aldana lopez de iglesias,diversificado,privado,urbana,cerrada temporalmente,monolingue,doble,diario(regular),peten
17-06-0031-46,17-027,peten,san francisco,instituto diversificado por cooperativa de ensenanza,barrio san rafael,55513161,braulio amilcar chan tesucun,marianela lissbeth gongora reinoso,diversificado,cooperativa,urbana,abierta,monolingue,vespertina,diario(regular),peten
17-06-0033-46,17-027,peten,san francisco,"centro educativo ""mayab""",3era.calle 10ma. av. zona 1,54826739,braulio amilcar chan tesucun,karina lisset romero ochaeta,diversificado,privado,urbana,abierta,monolingue,vespertina,diario(regular),peten
17-06-0036-46,desconocido,peten,san francisco,"instituto nacional diversificado de bachillerato industrial ""lic. roderico santos segura trujillo""",barrio concordia,79274363,desconocido,jose joel lopez alay,diversificado,oficial,urbana,abierta,monolingue,doble,diario(regular),peten
17-06-0037-46,17-027,peten,san francisco,instituto tecnico de capacitacion y productividad-intecap,caserio santa cruz,77402100,braulio amilcar chan tesucun,thelma carmelita tesucun,diversificado,privado,rural,abierta,monolingue,doble,diario(regular),peten
17-06-0040-46,17-027,peten,san francisco,instituto tecnico municipal de formacion,barrio san rafael,57096352,braulio amilcar chan tesucun,adam roberto ayala edwards,diversificado,privado,urbana,abierta,monolingue,sin jornada,semipresencial (un dia a la semana),peten
17-06-0121-46,17-027,peten,san francisco,"instituto nacional diversificado de bachillerato industrial ""lic. roderico santos segura trujillo""",barrio concordia,79274363,braulio amilcar chan tesucun,victor manuel ayala chavarria,diversificado,oficial,urbana,abierta,monolingue,vespertina,diario(regular),peten
17-06-1045-46,17-010,peten,san francisco,colegio vocacional de ciencias comerciales,san francisco,desconocido,edwin humberto montero aldana,jorge mario ochaeta,diversificado,privado,urbana,cerrada temporalmente,monolingue,nocturna,diario(regular),peten
17-07-0010-46,17-011,peten,santa ana,instituto nacional de educacion diversificada,aldea los angeles,46413739,gustavo adolfo reynoso herrera,desconocido,diversificado,oficial,rural,abierta,monolingue,matutina,diario(regular),peten
17-07-0029-46,17-010,peten,santa ana,"colegio privado ""getzemani""",aldea el mango,46044932,edwin humberto montero aldana,concepcion ortiz garcia,diversificado,privado,rural,cerrada temporalmente,monolingue,vespertina,diario(regular),peten
17-07-0033-46,17-010,peten,santa ana,instituto mixto de educacion bilingue intercultural-imebi-,aldea la laguna,58887789,edwin humberto montero aldana,jose gabriel garcia izaguirre,diversificado,privado,rural,cerrada temporalmente,monolingue,vespertina,diario(regular),peten
17-07-0037-46,17-011,peten,santa ana,centro educativo integral manantial de sabiduria,"5ta..avenida, zona 1 barrio el centro",40698999,gustavo adolfo reynoso herrera,ascencion lopez hernandez,diversificado,privado,urbana,abierta,monolingue,matutina,diario(regular),peten
17-07-0041-46,17-011,peten,santa ana,colegio cristiano arbol de vida,aldea los angeles,77923502,gustavo adolfo reynoso herrera,pem. enma judth paz cruz,diversificado,privado,rural,abierta,monolingue,vespertina,diario(regular),peten
17-07-0043-46,17-011,peten,santa ana,liceo educativo santa ana -licesa-,barrio el centro,32608217,gustavo adolfo reynoso herrera,luis alberto roca alvarez,diversificado,privado,urbana,abierta,monolingue,doble,fin de semana,peten
17-07-0044-46,17-011,peten,santa ana,centro educativo integral manantial de sabiduria-ceimsa-,5a.av.zona 1 barrio el centro,51689548,gustavo adolfo reynoso herrera,ascencion lopez hernandez,diversificado,privado,urbana,abierta,monolingue,doble,fin de semana,peten
17-07-0045-46,17-011,peten,santa ana,centro educativo integral manantial de sabiduria -ceimsa-,5a.av.zona 1 barrio el centro,51689548,gustavo adolfo reynoso herrera,ascencion lopez hernandez,diversificado,privado,urbana,abierta,monolingue,doble,fin de semana,peten
17-07-0048-46,17-011,peten,santa ana,colegio cristiano arbol de vida,alde los angeles,77923502,gustavo adolfo reynoso herrera,enma judith paz cruz,diversificado,privado,rural,abierta,bilingue,vespertina,diario(regular),peten
17-07-0049-46,17-011,peten,santa ana,colegio cristiano arbol de vida,aldea los angeles,77923502,gustavo adolfo reynoso herrera,enma judith paz cruz,diversificado,privado,rural,cerrada temporalmente,bilingue,vespertina,diario(regular),peten
17-07-0051-46,17-011,peten,santa ana,"colegio privado mixto ""getzemani""",aldea el mango,58810710,gustavo adolfo reynoso herrera,concepcion ortiz garcia,diversificado,privado,rural,abierta,monolingue,doble,fin de semana,peten
